Name,Source,Page,Level,Casting Time,Duration,School,Range,Components,Classes,Optional/Variant Classes,Subclasses,Text,At Higher Levels
Thunder Step,XGE,168,3rd,Action,Instantaneous,Conjuration,90 feet,V,,"Sorcerer (PHB'14), Sorcerer (PHB'24), Warlock (PHB'14), Warlock (PHB'24), Wizard (PHB'14), Wizard (PHB'24)","Arcane Trickster (PHB'24) Rogue, Arcane Trickster (PHB'14) Rogue, Lore (PHB'24) Bard, Eldritch Knight (PHB'24) Fighter, Eldritch Knight (PHB'14) Fighter","You teleport yourself to an unoccupied space you can see within range. Immediately after you disappear, a thunderous boom sounds, and each creature within 10 feet of the space you left must make a Constitution saving throw, taking 3d10 thunder damage on a failed save, or half as much damage on a successful one. The thunder can be heard from up to 300 feet away.You can bring along objects as long as their weight doesn't exceed what you can carry. You can also teleport one willing creature of your size or smaller who is carrying gear up to its carrying capacity. The creature must be within 5 feet of you when you cast this spell, and there must be an unoccupied space within 5 feet of your destination space for the creature to appear in; otherwise, the creature is left behind.","At Higher Levels. When you cast this spell using a spell slot of 4th level or higher, the damage increases by 1d10 for each slot level above 3rd."
Tidal Wave,XGE,168,3rd,Action,Instantaneous,Conjuration,120 feet,"V, S, M (a drop of water)",,"Druid (PHB'14), Druid (PHB'24), Sorcerer (PHB'14), Sorcerer (PHB'24), Wizard (PHB'14), Wizard (PHB'24)","Arcane Trickster (PHB'24) Rogue, Arcane Trickster (PHB'14) Rogue, Lore (PHB'24) Bard, Eldritch Knight (PHB'24) Fighter, Eldritch Knight (PHB'14) Fighter","You conjure up a wave of water that crashes down on an area within range. The area can be up to 30 feet long, up to 10 feet wide, and up to 10 feet tall. Each creature in that area must make a Dexterity saving throw. On a failed save, a creature takes 4d8 bludgeoning damage and is knocked prone. On a successful save, a creature takes half as much damage and isn't knocked prone. The water then spreads out across the ground in all directions, extinguishing unprotected flames in its area and within 30 feet of it, and then it vanishes.",
Tiny Servant,XGE,168,3rd,1 Min.,8 hours,Transmutation,Touch,"V, S",,"Artificer (TCE), Wizard (PHB'14), Wizard (PHB'24)","Arcane Trickster (PHB'24) Rogue, Arcane Trickster (PHB'14) Rogue, Lore (PHB'24) Bard, Eldritch Knight (PHB'24) Fighter, Eldritch Knight (PHB'14) Fighter","You touch one Tiny, nonmagical object that isn't attached to another object or a surface and isn't being carried by another creature. The target animates and sprouts little arms and legs, becoming a creature under your control until the spell ends or the creature drops to 0 hit points. See the stat block for its statistics.As a bonus action, you can mentally command the creature if it is within 120 feet of you. (If you control multiple creatures with this spell, you can command any or all of them at the same time, issuing the same command to each one.) You decide what action the creature will take and where it will move during its next turn, or you can issue a simple, general command, such as to fetch a key, stand watch, or stack some books. If you issue no commands, the servant does nothing other than defend itself against hostile creatures. Once given an order, the servant continues to follow that order until its task is complete.When the creature drops to 0 hit points, it reverts to its original form, and any remaining damage carries over to that form.","At Higher Levels. When you cast this spell using a spell slot of 4th level or higher, you can animate two additional objects for each slot level above 3rd."
Tongues,PHB'24,334,3rd,Action,1 hour,Divination,Touch,"V, M (a miniature ziggurat)","Bard (PHB'24), Cleric (PHB'24), Sorcerer (PHB'24), Warlock (PHB'24), Wizard (PHB'24)",,"Arcane Trickster (PHB'24) Rogue, Arcane Trickster (PHB'14) Rogue, Lore (PHB'24) Bard, Divine Soul (XGE) Sorcerer, Divine Soul (XGE) Sorcerer, Diviner (PHB'24) Wizard, Eldritch Knight (PHB'24) Fighter, Eldritch Knight (PHB'14) Fighter","This spell grants the creature you touch the ability to understand any spoken or signed language that it hears or sees. Moreover, when the target communicates by speaking or signing, any creature that knows at least one language can understand it if that creature can hear the speech or see the signing.",
Vampiric Touch,PHB'24,337,3rd,Action,"Concentration, up to 1 minute",Necromancy,Self,"V, S","Sorcerer (PHB'24), Warlock (PHB'24), Wizard (PHB'24)",,"Arcane Trickster (PHB'24) Rogue, Arcane Trickster (PHB'14) Rogue, Lore (PHB'24) Bard, Death (DMG'14) Cleric, Death (DMG'14) Cleric, Eldritch Knight (PHB'24) Fighter, Eldritch Knight (PHB'14) Fighter, Grave (XGE) Cleric, Grave (XGE) Cleric, Lunar (DSotDQ) Sorcerer, Lunar (DSotDQ) Sorcerer, Ambition (PSA) (PSA) Cleric, Ambition (PSA) (PSA) Cleric","The touch of your shadow-wreathed hand can siphon life force from others to heal your wounds. Make a melee spell attack against one creature within reach. On a hit, the target takes 3d6 Necrotic damage, and you regain Hit Points equal to half the amount of Necrotic damage dealt.Until the spell ends, you can make the attack again on each of your turns as a Magic action, targeting the same creature or a different one.",Using a Higher-Level Spell Slot. The damage increases by 1d6 for each spell slot level above 3.
Wall of Sand,XGE,170,3rd,Action,"Concentration, up to 10 minutes",Evocation,90 feet,"V, S, M (a handful of sand)",,"Wizard (PHB'14), Wizard (PHB'24)","Arcane Trickster (PHB'24) Rogue, Arcane Trickster (PHB'14) Rogue, Lore (PHB'24) Bard, Eldritch Knight (PHB'24) Fighter, Eldritch Knight (PHB'14) Fighter, Evoker (PHB'24) Wizard","You create a wall of swirling sand on the ground at a point you can see within range. You can make the wall up to 30 feet long, 10 feet high, and 10 feet thick, and it vanishes when the spell ends. It blocks line of sight but not movement. A creature is blinded while in the wall's space and must spend 3 feet of movement for every 1 foot it moves there.",
Wall of Water,XGE,170,3rd,Action,"Concentration, up to 10 minutes",Evocation,60 feet,"V, S, M (a drop of water)",,"Druid (PHB'14), Druid (PHB'24), Sorcerer (PHB'14), Sorcerer (PHB'24), Wizard (PHB'14), Wizard (PHB'24)","Arcane Trickster (PHB'24) Rogue, Arcane Trickster (PHB'14) Rogue, Lore (PHB'24) Bard, Eldritch Knight (PHB'24) Fighter, Eldritch Knight (PHB'14) Fighter, Evoker (PHB'24) Wizard","You create a wall of water on the ground at a point you can see within range. You can make the wall up to 30 feet long, 10 feet high, and 1 foot thick, or you can make a ringed wall up to 20 feet in diameter, 20 feet high, and 1 foot thick. The wall vanishes when the spell ends. The wall's space is difficult terrain.Any ranged weapon attack that enters the wall's space has disadvantage on the attack roll, and fire damage is halved if the fire effect passes through the wall to reach its target. Spells that deal cold damage that pass through the wall cause the area of the wall they pass through to freeze solid (at least a 5-foot-square section is frozen). Each 5-foot-square frozen section has AC 5 and 15 hit points. Reducing a frozen section to 0 hit points destroys it. When a section is destroyed, the wall's water doesn't fill it.",
Water Breathing,PHB'24,340,3rd,Action,24 hours,Transmutation (ritual),30 feet,"V, S, M (a short reed)","Artificer (TCE), Druid (PHB'24), Ranger (PHB'24), Sorcerer (PHB'24), Wizard (PHB'24)",,"Arcane Trickster (PHB'24) Rogue, Arcane Trickster (PHB'14) Rogue, Land (Coast) (PHB'14) Druid, Sea (PHB'24) Druid, Lore (PHB'24) Bard, Eldritch Knight (PHB'24) Fighter, Eldritch Knight (PHB'14) Fighter",This spell grants up to ten willing creatures of your choice within range the ability to breathe underwater until the spell ends. Affected creatures also retain their normal mode of respiration.,
Water Walk,PHB'24,340,3rd,Action,1 hour,Transmutation (ritual),30 feet,"V, S, M (a piece of cork)","Artificer (TCE), Cleric (PHB'24), Druid (PHB'24), Ranger (PHB'24), Sorcerer (PHB'24)",,"Land (Coast) (PHB'14) Druid, Land (Swamp) (PHB'14) Druid, Lore (PHB'24) Bard, Divine Soul (XGE) Sorcerer, Divine Soul (XGE) Sorcerer","This spell grants the ability to move across any liquid surface—such as water, acid, mud, snow, quicksand, or lava—as if it were harmless solid ground (creatures crossing molten lava can still take damage from the heat). Up to ten willing creatures of your choice within range gain this ability for the duration.An affected target must take a Bonus Action to pass from the liquid's surface into the liquid itself and vice versa, but if the target falls into the liquid, the target passes through the surface into the liquid below.",
Wind Wall,PHB'24,341,3rd,Action,"Concentration, up to 1 minute",Evocation,120 feet,"V, S, M (a fan and a feather)","Druid (PHB'24), Ranger (PHB'24)",,"Artillerist (TCE) Artificer, Lore (PHB'24) Bard, Nature (PHB'14) Cleric, Nature (PHB'14) Cleric, Genie (Djinni) (TCE) Warlock, Genie (Djinni) (TCE) Warlock","A wall of strong wind rises from the ground at a point you choose within range. You can make the wall up to 50 feet long, 15 feet high, and 1 foot thick. You can shape the wall in any way you choose so long as it makes one continuous path along the ground. The wall lasts for the duration.When the wall appears, each creature in its area makes a Strength saving throw, taking 4d8 Bludgeoning damage on a failed save or half as much damage on a successful one.The strong wind keeps fog, smoke, and other gases at bay. Small or smaller flying creatures or objects can't pass through the wall. Loose, lightweight materials brought into the wall fly upward. Arrows, bolts, and other ordinary projectiles launched at targets behind the wall are deflected upward and miss automatically. Boulders hurled by Giants or siege engines, and similar projectiles, are unaffected. Creatures in gaseous form can't pass through it.",
