Name,Source,Page,Level,Casting Time,Duration,School,Range,Components,Classes,Optional/Variant Classes,Subclasses,Text,At Higher Levels
Hunger of Hadar,PHB'24,286,3rd,Action,"Concentration, up to 1 minute",Conjuration,150 feet,"V, S, M (a pickled tentacle)",Warlock (PHB'24),,"Aberrant Mind (TCE) Sorcerer, Aberrant (PHB'24) Sorcerer, Great Old One (PHB'24) Warlock","You open a gateway to the Far Realm, a region infested with unspeakable horrors. A 20-foot-radius Sphere of Darkness appears, centered on a point with range and lasting for the duration. The Sphere is Difficult Terrain, and it is filled with strange whispers and slurping noises, which can be heard up to 30 feet away. No light, magical or otherwise, can illuminate the area, and creatures fully within it have the Blinded condition.Any creature that starts its turn in the area takes 2d6 Cold damage. Any creature that ends its turn there must succeed on a Dexterity saving throw or take 2d6 Acid damage from otherworldly tentacles.",Using a Higher-Level Spell Slot. The Cold or Acid damage (your choice) increases by 1d6 for each spell slot level above 3.
Hypnotic Pattern,PHB'24,287,3rd,Action,"Concentration, up to 1 minute",Illusion,120 feet,"S, M (a pinch of confetti)","Bard (PHB'24), Sorcerer (PHB'24), Warlock (PHB'24), Wizard (PHB'24)",,"Arcane Trickster (PHB'24) Rogue, Arcane Trickster (PHB'14) Rogue, Armorer (TCE) Artificer, Lore (PHB'24) Bard, Eldritch Knight (PHB'24) Fighter, Eldritch Knight (PHB'14) Fighter, Illusionist (PHB'24) Wizard, Moon (TDCSR) Cleric, Moon (TDCSR) Cleric, Redemption (XGE) Paladin, Redemption (XGE) Paladin, Trickery (PHB'24) Cleric","You create a twisting pattern of colors in a 30-foot Cube within range. The pattern appears for a moment and vanishes. Each creature in the area who can see the pattern must succeed on a Wisdom saving throw or have the Charmed condition for the duration. While Charmed, the creature has the Incapacitated condition and a Speed of 0.The spell ends for an affected creature if it takes any damage or if someone else uses an action to shake the creature out of its stupor.",
Incite Greed,AI,76,3rd,Action,"Concentration, up to 1 minute",Enchantment,30 feet,"V, S, M (a gem worth at least 50 gp)","Cleric (PHB'14), Cleric (PHB'24), Warlock (PHB'14), Warlock (PHB'24), Wizard (PHB'14), Wizard (PHB'24)",,"Arcane Trickster (PHB'24) Rogue, Arcane Trickster (PHB'14) Rogue, Lore (PHB'24) Bard, Divine Soul (XGE) Sorcerer, Divine Soul (XGE) Sorcerer, Eldritch Knight (PHB'24) Fighter, Eldritch Knight (PHB'14) Fighter","When you cast this spell, you present the gem used as the material component and choose any number of creatures within range that can see you. Each target must succeed on a Wisdom saving throw or be charmed by you until the spell ends, or until you or your companions do anything harmful to it. While charmed in this way, a creature can do nothing but use its movement to approach you in a safe manner. While an affected creature is within 5 feet of you, it cannot move, but simply stares greedily at the gem you present.At the end of each of its turns, an affected target can make a Wisdom saving throw. If it succeeds, this effect ends for that target.",
Life Transference,XGE,160,3rd,Action,Instantaneous,Necromancy,30 feet,"V, S",,"Cleric (PHB'14), Cleric (PHB'24), Wizard (PHB'14), Wizard (PHB'24)","Arcane Trickster (PHB'24) Rogue, Arcane Trickster (PHB'14) Rogue, Lore (PHB'24) Bard, Divine Soul (XGE) Sorcerer, Divine Soul (XGE) Sorcerer, Eldritch Knight (PHB'24) Fighter, Eldritch Knight (PHB'14) Fighter","You sacrifice some of your health to mend another creature's injuries. You take 4d8 necrotic damage, which can't be reduced in any way, and one creature of your choice that you can see within range regains a number of hit points equal to twice the necrotic damage you take.","At Higher Levels. When you cast this spell using a spell slot of 4th level or higher, the damage increases by 1d8 for each slot level above 3rd."
Lightning Arrow,PHB'24,292,3rd,Bonus,Instantaneous,Transmutation,Self,"V, S",Ranger (PHB'24),,,"As your attack hits or misses the target, the weapon or ammunition you're using transforms into a lightning bolt. Instead of taking any damage or other effects from the attack, the target takes 4d8 Lightning damage on a hit or half as much damage on a miss. Each creature within 10 feet of the target then makes a Dexterity saving throw, taking 2d8 Lightning damage on a failed save or half as much damage on a successful one.The weapon or ammunition then returns to its normal form.",Using a Higher-Level Spell Slot. The damage for both effects of the spell increases by 1d8 for each spell slot level above 3.
Lightning Bolt,PHB'24,292,3rd,Action,Instantaneous,Evocation,Self,"V, S, M (a bit of fur and a crystal rod)","Sorcerer (PHB'24), Wizard (PHB'24)",,"Arcane Trickster (PHB'24) Rogue, Arcane Trickster (PHB'14) Rogue, Armorer (TCE) Artificer, Land (Temperate Land) (PHB'24) Druid, Land (Mountain) (PHB'14) Druid, Sea (PHB'24) Druid, Lore (PHB'24) Bard, Eldritch Knight (PHB'24) Fighter, Eldritch Knight (PHB'14) Fighter, Evoker (PHB'24) Wizard, Fathomless (TCE) Warlock, Fathomless (TCE) Warlock","A stroke of lightning forming a 100-foot-long, 5-foot-wide Line blasts out from you in a direction you choose. Each creature in the Line makes a Dexterity saving throw, taking 8d6 Lightning damage on a failed save or half as much damage on a successful one.",Using a Higher-Level Spell Slot. The damage increases by 1d6 for each spell slot level above 3.
Major Image,PHB'24,295,3rd,Action,"Concentration, up to 10 minutes",Illusion,120 feet,"V, S, M (a bit of fleece)","Bard (PHB'24), Sorcerer (PHB'24), Warlock (PHB'24), Wizard (PHB'24)",,"Arcane Trickster (PHB'24) Rogue, Arcane Trickster (PHB'14) Rogue, Lore (PHB'24) Bard, Eldritch Knight (PHB'24) Fighter, Eldritch Knight (PHB'14) Fighter, Illusionist (PHB'24) Wizard, Moon (TDCSR) Cleric, Moon (TDCSR) Cleric","You create the image of an object, a creature, or some other visible phenomenon that is no larger than a 20-foot Cube. The image appears at a spot that you can see within range and lasts for the duration. It seems real, including sounds, smells, and temperature appropriate to the thing depicted, but it can't deal damage or cause conditions.If you are within range of the illusion, you can take a Magic action to cause the image to move to any other spot within range. As the image changes location, you can alter its appearance so that its movements appear natural for the image. For example, if you create an image of a creature and move it, you can alter the image so that it appears to be walking. Similarly, you can cause the illusion to make different sounds at different times, even making it carry on a conversation, for example.Physical interaction with the image reveals it to be an illusion, for things can pass through it. A creature that takes a Study action to examine the image can determine that it is an illusion with a successful Intelligence (Investigation) check against your spell save DC. If a creature discerns the illusion for what it is, the creature can see through the image, and its other sensory qualities become faint to the creature.","Using a Higher-Level Spell Slot. The spell lasts until dispelled, without requiring Concentration, if cast with a level 4+ spell slot."
Mass Healing Word,PHB'24,296,3rd,Bonus,Instantaneous,Abjuration,60 feet,V,"Bard (PHB'24), Cleric (PHB'24)",,"Alchemist (TCE) Artificer, Lore (PHB'24) Bard, Divine Soul (XGE) Sorcerer, Divine Soul (XGE) Sorcerer, Life (PHB'24) Cleric, Order (TCE) Cleric, Order (TCE) Cleric",Up to six creatures of your choice that you can see within range regain Hit Points equal to 2d4 plus your spellcasting ability modifier.,Using a Higher-Level Spell Slot. The healing increases by 1d4 for each spell slot level above 3.
Melf's Minute Meteors,XGE,161,3rd,Action,"Concentration, up to 10 minutes",Evocation,Self,"V, S, M (niter, sulfur, and pine tar formed into a bead)",,"Sorcerer (PHB'14), Sorcerer (PHB'24), Wizard (PHB'14), Wizard (PHB'24)","Arcane Trickster (PHB'24) Rogue, Arcane Trickster (PHB'14) Rogue, Lore (PHB'24) Bard, Eldritch Knight (PHB'24) Fighter, Eldritch Knight (PHB'14) Fighter, Evoker (PHB'24) Wizard","You create six tiny meteors in your space. They float in the air and orbit you for the spell's duration. When you cast the spell—and as a bonus action on each of your turns thereafter—you can expend one or two of the meteors, sending them streaking toward a point or points you choose within 120 feet of you. Once a meteor reaches its destination or impacts against a solid surface, the meteor explodes. Each creature within 5 feet of the point where the meteor explodes must make a Dexterity saving throw. A creature takes 2d6 fire damage on a failed save, or half as much damage on a successful one.","At Higher Levels. When you cast this spell using a spell slot of 4th level or higher, the number of meteors created increases by two for each slot level above 3rd."
Motivational Speech,AI,77,3rd,1 Min.,1 hour,Enchantment,60 feet,V,"Bard (PHB'14), Bard (PHB'24), Cleric (PHB'14), Cleric (PHB'24)",,"Lore (PHB'24) Bard, Divine Soul (XGE) Sorcerer, Divine Soul (XGE) Sorcerer","“I once heard a motivational speech by Jim and it was the worst ninety seconds of my life. What does Omin see in him, anyway?”— Walnut DankgrassYou address allies, staff, or innocent bystanders to exhort and inspire them to greatness, whether they have anything to get excited about or not. Choose up to five creatures within range that can hear you. For the duration, each affected creature gains 5 temporary hit points and has advantage on Wisdom saving throws. If an affected creature is hit by an attack, it has advantage on the next attack roll it makes. Once an affected creature loses the temporary hit points granted by this spell, the spell ends for that creature.","At Higher Levels. When you cast this spell using a spell slot of 4th level or higher, the temporary hit points increase by 5 for each slot level above 3rd."
Phantom Steed,PHB'24,304,3rd,1 Min.,1 hour,Illusion (ritual),30 feet,"V, S",Wizard (PHB'24),,"Arcane Trickster (PHB'24) Rogue, Arcane Trickster (PHB'14) Rogue, Lore (PHB'24) Bard, Eldritch Knight (PHB'24) Fighter, Eldritch Knight (PHB'14) Fighter, Illusionist (PHB'24) Wizard, Lunar (DSotDQ) Sorcerer, Lunar (DSotDQ) Sorcerer, Undead (VRGR) Warlock, Undead (VRGR) Warlock","A Large, quasi-real, horselike creature appears on the ground in an unoccupied space of your choice within range. You decide the creature's appearance, and it is equipped with a saddle, bit, and bridle. Any of the equipment created by the spell vanishes in a puff of smoke if it is carried more than 10 feet away from the steed.For the duration, you or a creature you choose can ride the steed. The steed uses the Riding Horse stat block, except it has a Speed of 100 feet and can travel 13 miles in an hour. When the spell ends, the steed gradually fades, giving the rider 1 minute to dismount. The spell ends early if the steed takes any damage.",
Plant Growth,PHB'24,305,3rd,Action,Instantaneous,Transmutation,150 feet,"V, S","Bard (PHB'24), Druid (PHB'24), Ranger (PHB'24)",,"Archfey (PHB'24) Warlock, Wildfire (TCE) Druid, Wildfire (TCE) Druid, Land (Forest) (PHB'14) Druid, Lore (PHB'24) Bard, Nature (PHB'14) Cleric, Nature (PHB'14) Cleric, Ancients (PHB'24) Paladin, Ancients (PHB'14) Paladin, Archfey (PHB'14) Warlock",This spell channels vitality into plants. The casting time you use determines whether the spell has the Overgrowth or the Enrichment effect below. Overgrowth. Choose a point within range. All normal plants in a 100-foot-radius Sphere centered on that point become thick and overgrown. A creature moving through that area must spend 4 feet of movement for every 1 foot it moves. You can exclude one or more areas of any size within the spell's area from being affected. Enrichment. All plants in a half-mile radius centered on a point within range become enriched for 365 days. The plants yield twice the normal amount of food when harvested. They can benefit from only one Plant Growth per year.,
Protection from Energy,PHB'24,309,3rd,Action,"Concentration, up to 1 hour",Abjuration,Touch,"V, S","Artificer (TCE), Cleric (PHB'24), Druid (PHB'24), Ranger (PHB'24), Sorcerer (PHB'24), Wizard (PHB'24)",,"Abjurer (PHB'24) Wizard, Arcane Trickster (PHB'24) Rogue, Arcane Trickster (PHB'14) Rogue, Land (Desert) (PHB'14) Druid, Clockwork (PHB'24) Sorcerer, Clockwork Soul (TCE) Sorcerer, Lore (PHB'24) Bard, Divine Soul (XGE) Sorcerer, Divine Soul (XGE) Sorcerer, Eldritch Knight (PHB'24) Fighter, Eldritch Knight (PHB'14) Fighter, Forge (XGE) Cleric, Forge (XGE) Cleric, Glory (PHB'24) Paladin, Glory (TCE) Paladin, Vengeance (PHB'24) Paladin, Vengeance (PHB'14) Paladin, Ancients (PHB'24) Paladin, Ancients (PHB'14) Paladin, Strength (PSA) (PSA) Cleric, Strength (PSA) (PSA) Cleric","For the duration, the willing creature you touch has Resistance to one damage type of your choice: Acid, Cold, Fire, Lightning, or Thunder.",
Revivify,PHB'24,312,3rd,Action,Instantaneous,Necromancy,Touch,"V, S, M (a diamond worth 300+ GP, which the spell consumes)","Artificer (TCE), Cleric (PHB'24), Druid (PHB'24), Paladin (PHB'24), Ranger (PHB'24)",,"Celestial (PHB'24) Warlock, Wildfire (TCE) Druid, Wildfire (TCE) Druid, Lore (PHB'24) Bard, Divine Soul (XGE) Sorcerer, Divine Soul (XGE) Sorcerer, Grave (XGE) Cleric, Grave (XGE) Cleric, Life (PHB'24) Cleric, Life (PHB'14) Cleric, Celestial (XGE) Warlock","You touch a creature that has died within the last minute. That creature revives with 1 Hit Point. This spell can't revive a creature that has died of old age, nor does it restore any missing body parts.",
Sending,PHB'24,314,3rd,Action,Instantaneous,Divination,Unlimited,"V, S, M (a copper wire)","Bard (PHB'24), Cleric (PHB'24), Wizard (PHB'24)",,"Aberrant Mind (TCE) Sorcerer, Aberrant (PHB'24) Sorcerer, Arcane Trickster (PHB'24) Rogue, Arcane Trickster (PHB'14) Rogue, Lore (PHB'24) Bard, Divine Soul (XGE) Sorcerer, Divine Soul (XGE) Sorcerer, Diviner (PHB'24) Wizard, Eldritch Knight (PHB'24) Fighter, Eldritch Knight (PHB'14) Fighter, Peace (TCE) Cleric, Peace (TCE) Cleric, Great Old One (PHB'14) Warlock","You send a short message of 25 words or fewer to a creature you have met or a creature described to you by someone who has met it. The target hears the message in its mind, recognizes you as the sender if it knows you, and can answer in a like manner immediately. The spell enables targets to understand the meaning of your message.You can send the message across any distance and even to other planes of existence, but if the target is on a different plane than you, there is a 5 percent chance that the message doesn't arrive. You know if the delivery fails.Upon receiving your message, a creature can block your ability to reach it again with this spell for 8 hours. If you try to send another message during that time, you learn that you are blocked, and the spell fails.",
Slow,PHB'24,318,3rd,Action,"Concentration, up to 1 minute",Transmutation,120 feet,"V, S, M (a drop of molasses)","Bard (PHB'24), Sorcerer (PHB'24), Wizard (PHB'24)",,"Arcane Trickster (PHB'24) Rogue, Arcane Trickster (PHB'14) Rogue, Blood (TDCSR) Cleric, Blood (TDCSR) Cleric, Land (Arctic) (PHB'14) Druid, Lore (PHB'24) Bard, Eldritch Knight (PHB'24) Fighter, Eldritch Knight (PHB'14) Fighter, Order (TCE) Cleric, Order (TCE) Cleric","You alter time around up to six creatures of your choice in a 40-foot Cube within range. Each target must succeed on a Wisdom saving throw or be affected by this spell for the duration.An affected target's Speed is halved, it takes a -2 penalty to AC and Dexterity saving throws, and it can't take Reactions. On its turns, it can take either an action or a Bonus Action, not both, and it can make only one attack if it takes the Attack action. If it casts a spell with a Somatic component, there is a 25 percent chance the spell fails as a result of the target making the spell's gestures too slowly.An affected target repeats the save at the end of each of its turns, ending the spell on itself on a success.",
Speak with Plants,PHB'24,319,3rd,Action,10 minutes,Transmutation,Self,"V, S","Bard (PHB'24), Druid (PHB'24), Ranger (PHB'24)",,Lore (PHB'24) Bard,"You imbue plants in an immobile 30-foot Emanation with limited sentience and animation, giving them the ability to communicate with you and follow your simple commands. You can question plants about events in the spell's area within the past day, gaining information about creatures that have passed, weather, and other circumstances.You can also turn Difficult Terrain caused by plant growth (such as thickets and undergrowth) into ordinary terrain that lasts for the duration. Or you can turn ordinary terrain where plants are present into Difficult Terrain that lasts for the duration.The spell doesn't enable plants to uproot themselves and move about, but they can move their branches, tendrils, and stalks for you.If a Plant creature is in the area, you can communicate with it as if you shared a common language.",
Spirit Guardians,PHB'24,319,3rd,Action,"Concentration, up to 10 minutes",Conjuration,Self,"V, S, M (a prayer scroll)",Cleric (PHB'24),,"Lore (PHB'24) Bard, Divine Soul (XGE) Sorcerer, Divine Soul (XGE) Sorcerer, Crown (SCAG) Paladin, Crown (SCAG) Paladin, War (PHB'24) Cleric, War (PHB'14) Cleric","Protective spirits flit around you in a 15-foot Emanation for the duration. If you are good or neutral, their spectral form appears angelic or fey (your choice). If you are evil, they appear fiendish.When you cast this spell, you can designate creatures to be unaffected by it. Any other creature's Speed is halved in the Emanation, and whenever the Emanation enters a creature's space and whenever a creature enters the Emanation or ends its turn there, the creature must make a Wisdom saving throw. On a failed save, the creature takes 3d8 Radiant damage (if you are good or neutral) or 3d8 Necrotic damage (if you are evil). On a successful save, the creature takes half as much damage. A creature makes this save only once per turn.",Using a Higher-Level Spell Slot. The damage increases by 1d8 for each spell slot level above 3.
Spirit Shroud,TCE,108,3rd,Bonus,"Concentration, up to 1 minute",Necromancy,Self,"V, S",,"Cleric (PHB'14), Cleric (PHB'24), Paladin (PHB'14), Paladin (PHB'24), Warlock (PHB'14), Warlock (PHB'24), Wizard (PHB'14), Wizard (PHB'24)","Arcane Trickster (PHB'24) Rogue, Arcane Trickster (PHB'14) Rogue, Lore (PHB'24) Bard, Divine Soul (XGE) Sorcerer, Divine Soul (XGE) Sorcerer, Eldritch Knight (PHB'24) Fighter, Eldritch Knight (PHB'14) Fighter","You call forth spirits of the dead, which flit around you for the spell's duration. The spirits are intangible and invulnerable.Until the spell ends, any attack you make deals 1d8 extra damage when you hit a creature within 10 feet of you. This damage is radiant, necrotic, or cold (your choice when you cast the spell). Any creature that takes this damage can't regain hit points until the start of your next turn.In addition, any creature of your choice that you can see that starts its turn within 10 feet of you has its speed reduced by 10 feet until the start of your next turn.","At Higher Levels. When you cast this spell using a spell slot of 4th level or higher, the damage increases by 1d8 for every two slot levels above 3rd."
Stinking Cloud,PHB'24,321,3rd,Action,"Concentration, up to 1 minute",Conjuration,90 feet,"V, S, M (a rotten egg)","Bard (PHB'24), Sorcerer (PHB'24), Wizard (PHB'24)",,"Arcane Trickster (PHB'24) Rogue, Arcane Trickster (PHB'14) Rogue, Land (Tropical Land) (PHB'24) Druid, Land (Swamp) (PHB'14) Druid, Land (Underdark) (PHB'14) Druid, Lore (PHB'24) Bard, Eldritch Knight (PHB'24) Fighter, Eldritch Knight (PHB'14) Fighter, Fiend (PHB'24) Warlock, Fiend (PHB'14) Warlock","You create a 20-foot-radius Sphere of yellow, nauseating gas centered on a point within range. The cloud is Heavily Obscured. The cloud lingers in the air for the duration or until a strong wind (such as the one created by Gust of Wind) disperses it.Each creature that starts its turn in the Sphere must succeed on a Constitution saving throw or have the Poisoned condition until the end of the current turn. While Poisoned in this way, the creature can't take an action or a Bonus Action.",
Summon Fey,PHB'24,326,3rd,Action,"Concentration, up to 1 hour",Conjuration,90 feet,"V, S, M (a gilded flower worth 300+ GP)","Druid (PHB'24), Ranger (PHB'24), Warlock (PHB'24), Wizard (PHB'24)",,"Arcane Trickster (PHB'24) Rogue, Arcane Trickster (PHB'14) Rogue, Lore (PHB'24) Bard, Eldritch Knight (PHB'24) Fighter, Eldritch Knight (PHB'14) Fighter, Fey Wanderer (PHB'24) Ranger, Illusionist (PHB'24) Wizard","You call forth a Fey spirit. It manifests in an unoccupied space that you can see within range and uses the Fey Spirit stat block. When you cast the spell, choose a mood: Fuming, Mirthful, or Tricksy. The creature resembles a Fey creature of your choice marked by the chosen mood, which determines certain details in its stat block. The creature disappears when it drops to 0 Hit Points or when the spell ends.The creature is an ally to you and your allies. In combat, the creature shares your Initiative count, but it takes its turn immediately after yours. It obeys your verbal commands (no action required by you). If you don't issue any, it takes the Dodge action and uses its movement to avoid danger.",Using a Higher-Level Spell Slot. Use the spell slot's level for the spell's level in the stat block.
Summon Lesser Demons,XGE,167,3rd,Action,"Concentration, up to 1 hour",Conjuration,60 feet,"V, S, M (a vial of blood from a humanoid killed within the past 24 hours)",,"Warlock (PHB'14), Warlock (PHB'24), Wizard (PHB'14), Wizard (PHB'24)","Arcane Trickster (PHB'24) Rogue, Arcane Trickster (PHB'14) Rogue, Lore (PHB'24) Bard, Eldritch Knight (PHB'24) Fighter, Eldritch Knight (PHB'14) Fighter","You utter foul words, summoning demons from the chaos of the Abyss. Roll on the following table to determine what appears.d6Demons Summoned1-2Two demons of challenge rating 1 or lower3-4Four demons of challenge rating 1/2 or lower5-6Eight demons of challenge rating 1/4 or lowerThe DM chooses the demons, such as manes or dretches, and you choose the unoccupied spaces you can see within range where they appear. A summoned demon disappears when it drops to 0 hit points or when the spell ends.The demons are hostile to all creatures, including you. Roll initiative for the summoned demons as a group, which has its own turns. The demons pursue and attack the nearest non-demons to the best of their ability.As part of casting the spell, you can form a circle on the ground with the blood used as a material component. The circle is large enough to encompass your space. While the spell lasts, the summoned demons can't cross the circle or harm it, and they can't target anyone within it. Using the material component in this manner consumes it when the spell ends.","At Higher Levels. When you cast this spell using a spell slot of 6th or 7th level, you summon twice as many demons. If you cast it using a spell slot of 8th or 9th level, you summon three times as many demons."
Summon Shadowspawn,TCE,113,3rd,Action,"Concentration, up to 1 hour",Conjuration,90 feet,"V, S, M (tears inside a gem worth at least 300 gp)",,"Warlock (PHB'14), Warlock (PHB'24), Wizard (PHB'14), Wizard (PHB'24)","Arcane Trickster (PHB'24) Rogue, Arcane Trickster (PHB'14) Rogue, Lore (PHB'24) Bard, Eldritch Knight (PHB'24) Fighter, Eldritch Knight (PHB'14) Fighter","You call forth a shadowy spirit. It manifests in an unoccupied space that you can see within range. This corporeal form uses the Shadow Spirit stat block. When you cast the spell, choose an emotion: Fury, Despair, or Fear. The creature resembles a misshapen biped marked by the chosen emotion, which determines certain traits in its stat block. The creature disappears when it drops to 0 hit points or when the spell ends.The creature is an ally to you and your companions. In combat, the creature shares your initiative count, but it takes its turn immediately after yours. It obeys your verbal commands (no action required by you). If you don't issue any, it takes the Dodge action and uses its move to avoid danger.","At Higher Levels. When you cast this spell using a spell slot of 4th level or higher, use the higher level wherever the spell's level appears in the stat block."
Summon Undead,PHB'24,328,3rd,Action,"Concentration, up to 1 hour",Necromancy,90 feet,"V, S, M (a gilded skull worth 300+ GP)","Warlock (PHB'24), Wizard (PHB'24)",,"Arcane Trickster (PHB'24) Rogue, Arcane Trickster (PHB'14) Rogue, Lore (PHB'24) Bard, Eldritch Knight (PHB'24) Fighter, Eldritch Knight (PHB'14) Fighter","You call forth an Undead spirit. It manifests in an unoccupied space that you can see within range and uses the Undead Spirit stat block. When you cast the spell, choose the creature's form: Ghostly, Putrid, or Skeletal. The spirit resembles an Undead creature with the chosen form, which determines certain details in its stat block. The creature disappears when it drops to 0 Hit Points or when the spell ends.The creature is an ally to you and your allies. In combat, the creature shares your Initiative count, but it takes its turn immediately after yours. It obeys your verbal commands (no action required by you). If you don't issue any, it takes the Dodge action and uses its movement to avoid danger.",Using a Higher-Level Spell Slot. Use the spell slot's level for the spell's level in the stat block.
